{
  "$schema": "https://json-schema.org/draft/2020-12/schema",
  "$id": "https://dossier.dev/schemas/dossier.model/v1",
  "title": "dossier.model/v1",
  "description": "One Dossier document: a kind, metadata, an optional question for the reader, ordered sections with content parts or a board of items, and the reader's decisions.",
  "type": "object",
  "additionalProperties": false,
  "required": ["dossier", "kind", "meta", "sections"],
  "properties": {
    "dossier": { "const": "1.0" },
    "kind": { "type": "string", "pattern": "^[a-z][a-z0-9-]*$" },
    "meta": {
      "type": "object",
      "additionalProperties": false,
      "required": ["title", "slug"],
      "properties": {
        "title": { "type": "string", "minLength": 1, "maxLength": 200 },
        "slug": { "type": "string", "pattern": "^[a-z0-9][a-z0-9-]{0,63}$" },
        "kicker": { "type": "string", "maxLength": 200 },
        "emphasis": { "type": "string", "maxLength": 40, "description": "Legacy title emphasis, accepted for compatibility. Titles now render without decorative emphasis." },
        "lede": { "type": "string", "maxLength": 1000 },
        "updated": { "type": "string", "maxLength": 40 },
        "status": { "type": "string", "maxLength": 40 },
        "fonts": { "type": "string", "enum": ["google"], "description": "Opt in to web fonts. Omitted means the system stack and zero external requests." },
        "theme": {
          "type": "object",
          "additionalProperties": false,
          "properties": {
            "accent": { "type": "string", "pattern": "^#[0-9a-fA-F]{6}$", "description": "The brand color as #rrggbb. Light and dark variants are derived so text stays readable; a color too light for text is darkened with a warning." }
          }
        },
        "facts": {
          "type": "array",
          "maxItems": 4,
          "description": "Document-level figures shown first in the masthead strip, such as severity or version.",
          "items": {
            "type": "object",
            "additionalProperties": false,
            "required": ["label", "value"],
            "properties": {
              "label": { "type": "string", "minLength": 1, "maxLength": 40 },
              "value": { "type": "string", "minLength": 1, "maxLength": 40 },
              "tone": { "type": "string", "enum": ["teal", "violet", "risk", "neutral"] }
            }
          }
        }
      }
    },
    "choice": { "$ref": "#/$defs/choice" },
    "sections": {
      "type": "array",
      "minItems": 1,
      "items": { "$ref": "#/$defs/section" }
    },
    "decisions": { "$ref": "#/$defs/decisions" }
  },
  "$defs": {
    "id": { "type": "string", "pattern": "^[a-z0-9][a-z0-9-]{0,63}$" },
    "section": {
      "type": "object",
      "additionalProperties": false,
      "required": ["id", "title"],
      "properties": {
        "id": { "$ref": "#/$defs/id" },
        "title": { "type": "string", "minLength": 1, "maxLength": 200 },
        "parts": { "type": "array", "items": { "$ref": "#/$defs/part" } },
        "board": { "$ref": "#/$defs/board" }
      }
    },
    "part": {
      "type": "object",
      "additionalProperties": false,
      "required": ["type"],
      "properties": {
        "type": { "type": "string", "enum": ["prose", "spec", "table", "callout", "code", "figure", "diagram", "chart", "timeline"] },
        "title": { "type": "string", "maxLength": 200 },
        "tone": { "type": "string", "enum": ["note", "risk"] },
        "markdown": { "type": "string" },
        "columns": { "type": "array", "items": { "type": "string" } },
        "rows": { "type": "array", "items": { "type": "array", "items": { "type": "string" } } },
        "spec": { "type": "array", "items": { "type": "object", "additionalProperties": false, "required": ["label", "text"], "properties": { "label": { "type": "string" }, "text": { "type": "string" } } } },
        "note": { "type": "string", "maxLength": 1000 },
        "lang": { "type": "string", "maxLength": 40 },
        "code": { "type": "string" },
        "src": { "type": "string", "minLength": 1, "description": "Figure image: a path relative to the model file, a data:image URI, or an http(s) URL. Relative paths are inlined at build time." },
        "alt": { "type": "string", "maxLength": 400 },
        "caption": { "type": "string", "maxLength": 1000 },
        "source": { "type": "string", "description": "Diagram source in the given format." },
        "format": { "type": "string", "enum": ["dot", "mermaid"] },
        "variant": { "type": "string", "enum": ["bar", "line", "area"] },
        "data": { "type": "array", "items": { "type": "object", "additionalProperties": false, "required": ["label", "value"], "properties": { "label": { "type": "string" }, "value": { "type": "number" } } } },
        "events": {
          "type": "array",
          "description": "Timeline events in order. at is a time or date as written, such as 07:40 or 2026-01-14.",
          "items": {
            "type": "object",
            "additionalProperties": false,
            "required": ["at", "title"],
            "properties": {
              "at": { "type": "string", "minLength": 1, "maxLength": 40 },
              "title": { "type": "string", "minLength": 1, "maxLength": 200 },
              "markdown": { "type": "string" },
              "tone": { "type": "string", "enum": ["teal", "violet", "risk", "neutral"] }
            }
          }
        }
      }
    },
    "board": {
      "type": "object",
      "additionalProperties": false,
      "required": ["items"],
      "properties": {
        "summary": { "type": "boolean", "description": "Render a summary table before the items." },
        "layout": { "type": "string", "enum": ["articles", "rows"] },
        "items": { "type": "array", "minItems": 1, "items": { "$ref": "#/$defs/item" } }
      }
    },
    "item": {
      "type": "object",
      "additionalProperties": false,
      "required": ["id", "title"],
      "properties": {
        "id": { "$ref": "#/$defs/id" },
        "title": { "type": "string", "minLength": 1, "maxLength": 200 },
        "summary": { "type": "string", "maxLength": 400 },
        "size": { "type": "string", "maxLength": 40 },
        "category": { "type": "string", "maxLength": 40 },
        "severity": { "type": "string", "maxLength": 40 },
        "status": { "type": "string", "maxLength": 40 },
        "effort": { "type": "string", "maxLength": 40 },
        "impact": { "type": "integer", "minimum": 0, "maximum": 10 },
        "owner": { "type": "string", "maxLength": 80 },
        "required": { "type": "boolean" },
        "dependsOn": { "type": "array", "items": { "$ref": "#/$defs/id" } },
        "facets": { "type": "array", "items": { "type": "object", "additionalProperties": false, "required": ["label", "markdown"], "properties": { "label": { "type": "string", "minLength": 1, "maxLength": 60 }, "markdown": { "type": "string", "minLength": 1 } } } }
      }
    },
    "choice": {
      "type": "object",
      "additionalProperties": false,
      "required": ["question", "options"],
      "description": "One question the reader answers before the items, such as ship or hold. Option ids are single lowercase words that replies use.",
      "properties": {
        "question": { "type": "string", "minLength": 1, "maxLength": 120 },
        "options": {
          "type": "array",
          "minItems": 2,
          "maxItems": 6,
          "items": {
            "type": "object",
            "additionalProperties": false,
            "required": ["id", "label"],
            "properties": {
              "id": { "type": "string", "pattern": "^[a-z]{1,24}$" },
              "label": { "type": "string", "minLength": 1, "maxLength": 40 },
              "summary": { "type": "string", "maxLength": 200 }
            }
          }
        }
      }
    },
    "decisions": {
      "type": "object",
      "additionalProperties": false,
      "properties": {
        "path": { "type": "string", "maxLength": 40, "description": "The chosen option id." },
        "picked": { "type": "array", "items": { "$ref": "#/$defs/id" }, "description": "Picked item ids, in a pick kind." },
        "verdicts": { "type": "object", "additionalProperties": { "type": "string", "pattern": "^[a-z]{1,24}$" }, "description": "Verdict ids by item id, in a verdict kind." },
        "notes": { "type": "object", "additionalProperties": { "type": "string", "maxLength": 2000 } }
      }
    }
  }
}
